<?xml version="1.0"?> 
<xsd:schema xmlns:xsd="http://www.w3.org/2001/XMLSchema"
targetNamespace="http://www.showroom.org"
xmlns="http://www.showroom.org"
elementFormDefault="qualified">
    <xsd:element name="showroom">
        <xsd:complexType>
            <xsd:sequence>
                <xsd:element ref="car" minOccurs="1" maxOccurs="unbounded"></xsd:element>
            </xsd:sequence>
        </xsd:complexType>
    </xsd:element>
    <xsd:element name="car">
        <xsd:complexType> 
            <xsd:sequence> 
                <xsd:element ref="make" minOccurs="1" maxOccurs="1"/>
                <xsd:element ref="model" minOccurs="1" maxOccurs="1"/>
                <xsd:element ref="year" minOccurs="1" maxOccurs="1"/>
                <xsd:element ref="colour" minOccurs="1" maxOccurs="1"/>
                <xsd:element ref="transmission" minOccurs="1" maxOccurs="1"/>
                <xsd:element ref="engine" minOccurs="1" maxOccurs="1"/>
                <xsd:element ref="miles" minOccurs="1" maxOccurs="1"/>
                <xsd:element ref="price" minOccurs="1" maxOccurs="1"/>
            </xsd:sequence>
        </xsd:complexType>
    </xsd:element>
    <xsd:element name="make" type="xsd:string"></xsd:element>
    <xsd:element name="model" type="xsd:string"></xsd:element>
    <xsd:element name="year" type="xsd:string"></xsd:element>
    <xsd:element name="colour" type="xsd:string"></xsd:element>
    <xsd:element name="transmission">
        <xsd:complexType>
            <xsd:sequence>
                <xsd:element ref="numGears" minOccurs="1" maxOccurs="1"></xsd:element>
                <xsd:element ref="type" minOccurs="1" maxOccurs="1"></xsd:element>
            </xsd:sequence>
        </xsd:complexType>
    </xsd:element>    
    <xsd:element name="engine">
        <xsd:complexType>
            <xsd:sequence>
                <xsd:element ref="size" minOccurs="1" maxOccurs="1"></xsd:element>
                <xsd:element ref="fuel" minOccurs="1" maxOccurs="1"></xsd:element>
            </xsd:sequence>
        </xsd:complexType>
    </xsd:element>
    <xsd:element name="miles" type="xsd:string"></xsd:element>
    <xsd:element name="price" type="xsd:string"></xsd:element>
    <xsd:element name="numGears" type="xsd:string"></xsd:element>    
    <xsd:element name="type" type="xsd:string"></xsd:element>    
    <xsd:element name="size" type="xsd:string"></xsd:element>    
    <xsd:element name="fuel" type="xsd:string"></xsd:element>    
</xsd:schema>