<?xml version="1.0" encoding="UTF-8"?>
<showroom xmlns="http://www.showroom.org"
   xmlns:xsi="http://www.w3.org/2001/XMLSchema-instance"
   xsi:schemaLocation="http://www.showroom.org showroom.xsd">
	<car>
		<make>Ford</make>
		<model>Mondeo</model>
		<year>2007</year>
		<colour>Red</colour>
		<transmission>
			<numGears>5</numGears>
			<type>Manual</type>
		</transmission>
		<engine>
			<size>1.8</size>
			<fuel>Petrol</fuel>
		</engine>
		<miles>98000</miles>
		<price>3500</price>
	</car>
	<car>
		<make>BMW</make>
		<model>320D</model>
		<year>2005</year>
		<colour>Black</colour>
		<transmission>
			<numGears>6</numGears>
			<type>Automatic</type>
		</transmission>
		<engine>
			<size>2.0</size>
			<fuel>Diesel</fuel>
		</engine>
		<miles>130000</miles>
		<price>4000</price>
	</car>
</showroom>
